University Name,State,Country,Course Name,Average Fees (Per Year),Currency
"Texas A&M University, College Station",Texas,United States,MSc in Psychological Science,24129.0,USD
The University of Texas at Dallas,Texas,United States,MS in Psychology,44766.0,USD
Georgia Institute of Technology,Georgia,United States,MS in Psychology,15285.0,USD
University at Buffalo SUNY,New York,United States,MA in Psychology,23100.0,USD
The University of Texas at Arlington,Texas,United States,MS in Psychology,23161.0,USD
New York University,New York,United States,MA in Psychology,37332.0,USD
San Jose State University,California,United States,MA in Research and Experimental Psychology,14760.0,USD
University of Illinois at Chicago,Illinois,United States,MS in Psycology,12369.0,USD
University of Illinois at Chicago,Illinois,United States,MA in Psychology,16896.0,USD
"University of Maryland, College Park",Maryland,United States,Masters in Clinical Psychological Science,24330.0,USD
"The University of British Columbia, Vancouver",British Columbia,Canada,MA in Psychology,9500.0,CAD
Arizona State University,Arizona,United States,MS in Psychology,27792.0,USD
University of North Carolina at Charlotte,North Carolina,United States,MA in Psychology,20520.0,USD
University of North Carolina at Charlotte,North Carolina,United States,MA in Industrial/Organizational Psychology,15903.0,USD
"University of Michigan, Ann Arbor",Michigan,United States,MS in Psychology,22980.0,USD
Pennsylvania State University,Pennsylvania,United States,MS in Psychology,44996.0,USD
"University of California, Los Angeles",California,United States,MA in Psychology,33238.0,USD
University of Pennsylvania,Pennsylvania,United States,MA in Psychology,7282.0,USD
University of Toronto,Ontario,Canada,MA in Psychology,12050.0,CAD
Virginia Tech,Virginia,United States,MS in Psychology,,USD
Stony Brook University,New York,United States,MA in Psychology,28890.0,USD
University of Cincinnati,Ohio,United States,MA in Psychology,19995.0,USD
University of Waterloo,Ontario,Canada,MA in Psychology,23088.0,CAD
University of Colorado Boulder,Colorado,United States,Masters in Psychology,,USD
University of South Florida,Florida,United States,MA in  Psychological Sciences,21144.0,USD
University of Wisconsin-Madison,Wisconsin,United States,MS in Psychology,25548.0,USD
"University of California, Davis",California,United States,MS in Psychology,26544.0,USD
Michigan State University,Michigan,United States,MS in Psychology,29904.0,USD
McGill University,Montreal,Canada,Masters in Arts: Psychology,31455.0,CAD
San Diego State University,California,United States,MS in Applied Psychology,18696.0,USD
San Diego State University,California,United States,MS in Applied  Psychology,16698.0,USD
San Diego State University,California,United States,Masters in Psychology,14760.0,USD
"University of Maryland, Baltimore County",Maryland,United States,Masters in Human Services Psychology: Applied Behavior Analysis,21618.0,USD
Georgia State University,Georgia,United States,Masters in Psychology,,USD
"California State University, Fullerton",California,United States,MA in Psychological Research,17334.0,USD
George Mason University,Virginia,United States,MA in Psychology - Applied Developmental Psychology,22290.0,USD
University of Alberta,Alberta,Canada,MA in Psychology,8874.0,CAD
Clemson University,South Carolina,United States,Masters in Psychology,27510.0,USD
University of Windsor,Ontario,Canada,MA in Clinical Psychology,22995.0,CAD
University of Arizona,Arizona,United States,MA in Educational Psychology,26910.0,USD
Boston University,Massachusetts,United States,MA in Psychology,63798.0,USD
Iowa State University,Iowa,United States,MS in Psychology,33000.0,USD
Concordia University,Montreal,Canada,MA in Psychology,15233.0,CAD
"California State University, Los Angeles",California,United States,MA in Psychology,11470.0,USD
Texas A&M University - Kingsville,Texas,United States,MS in Psychology,14346.0,USD
University of North Carolina at Chapel Hill,North Carolina,United States,Masters in Psychology,,USD
Simon Fraser University,British Columbia,Canada,MA in Psychology,6198.0,CAD
Texas Tech University,Texas,United States,MEd in Educational Psychology,18407.0,USD
University of Dayton,Ohio,United States,MA in Psychology,15075.0,USD
Cleveland State University,Ohio,United States,MA in Psychology - Industrial-Organizational Research,25038.0,USD
Cleveland State University,Ohio,United States,MA in Clinical Psychology,32100.0,USD
State University of New York at Binghamton,New York,United States,"Masters in Psychology, Behavioral Neuroscience",,USD
"University of Michigan, Dearborn",Michigan,United States,MS in Psychology-Clinical Health Psychology,23040.0,USD
Queen's University,Kingston,Canada,MSc in Psychology,12927.0,CAD
Carleton University,Ottawa,Canada,MA in Psychology,18463.0,CAD
"California State University, Sacramento",California,United States,MA in Psychology,14760.0,USD
University of Pittsburgh,Pennsylvania,United States,MS in Psychology,43804.0,USD
University of Calgary,Alberta,Canada,MS in Psychology,5605.0,CAD
University of Calgary,Alberta,Canada,MSc (Thesis) in Psychology,8040.0,CAD
Dalhousie University,Nova Scotia,Canada,MSc in Psychology and Neuroscience,16860.0,CAD
Dalhousie University,Nova Scotia,Canada,MSc in Psychology,16860.0,CAD
York University,Toronto,Canada,MA in Psychology,19662.0,CAD
McMaster University,Hamilton,Canada,MSc in Psychotherapy,38802.0,CAD
McMaster University,Hamilton,Canada,MSc in Psychology,34089.0,CAD
Indiana University - Purdue University Indianapolis,Indiana,United States,MA in Psychology,18630.0,USD
University of Houston - Clear Lake,Texas,United States,MA in Industrial/Organizational Psychology,21465.0,USD
University of Houston - Clear Lake,Texas,United States,MS in Psychology,17172.0,USD
Toronto Metropolitan University,Toronto,Canada,MA in Psychological Science,25514.0,CAD
Northern Illinois University,Illinois,United States,M.A. in Psychology,12886.0,USD
RWTH Aachen University,North Rhine-Westphilia,Germany,Masters in Psychology,,EUR
"California State University, Northridge",California,United States,MA in Psychological Science,18593.0,USD
Florida State University,Florida,United States,MS in Psychology,13320.0,USD
University of Victoria,British Columbia,Canada,MSc in Psychology,7764.0,CAD
Drexel University,Pennsylvania,United States,MS in Psychology,30195.0,USD
The University of Melbourne,Victoria,Australia,Masters in Psychology (Clinical Psychology),53858.0,AUD
Pace University,New York,United States,MA in Psychology,26100.0,USD
The University of Chicago,Illinois,United States,Masters in Psychology,,USD
Kansas State University,Kansas,United States,MS in Psychology,14406.0,USD
San Francisco State University,California,United States,MS in Industrial/Organizational Psychology,20276.0,USD
San Francisco State University,California,United States,MS in Psychology,20824.0,USD
San Francisco State University,California,United States,Masters in Psychology,20276.0,USD
San Francisco State University,California,United States,"MA in Mind, Brain, and Behavior",20073.0,USD
San Francisco State University,California,United States,MS in Clinical Psychology,32550.0,USD
National University Of Singapore,Singapore,Singapore,MS in Psychology (Clinical),38800.0,SGD
West Virginia University,West Virginia,United States,MA in Psychology,27014.0,USD
"California State University, Chico",California,United States,MA in Psychology-Psychological Science,18180.0,USD
The University of Central Missouri,Missouri,United States,MS in Psychology,12204.0,USD
Kent State University,Ohio,United States,Masters in Educational Psychology,21952.0,USD
Lehigh University,Pennsylvania,United States,MS in Psychology,22500.0,USD
Florida International University,Florida,United States,MS in Psychology - Organizational Sciences,18018.0,USD
Florida International University,Florida,United States,Masters in Psychology,30030.0,USD
University of Oklahoma,Oklahoma,United States,M.S. in Psychology,17139.0,USD
Texas A&M University - Corpus Christi,Texas,United States,Masters in Clinical Psychology,26610.0,USD
Arkansas State University,Arkansas,United States,MS in Psychological Science,11520.0,USD
Western University,Ontario,Canada,MSc in Psychology,22662.0,CAD
"University of Alabama, Huntsville",Alabama,United States,MA in Psychology,25905.0,USD
Western University,Ontario,Canada,MSc in Psychology,22221.0,CAD
University of Saskatchewan,Saskatchewan,Canada,MA in Psychology,8096.0,CAD
Portland State University,Oregon,United States,MS in Psychology,18657.0,USD
DePaul University,Illinois,United States,MS in Psychology,18360.0,USD
DePaul University,Illinois,United States,MA in Psychological Sciences,18360.0,USD
University of Regina,Saskatchewan,Canada,MA in Psychology,9227.0,CAD
Monash University,Victoria,Australia,Masters in Professional Psychology,40500.0,AUD
University of Wisconsin-Milwaukee,Wisconsin,United States,MS in Psychology: Health Psychology,33138.0,USD
The University of Kansas,Kansas,United States,Masters in Psychology,14970.0,USD
University of Massachusetts Dartmouth,Massachusetts,United States,Masters in Psychology - Research,22176.0,USD
University of Massachusetts Dartmouth,Massachusetts,United States,Masters in Psychology - Clinical,24640.0,USD
University of Texas at San Antonio,Texas,United States,MS in Psychology,24192.0,USD
University of Manitoba,Manitoba,Canada,MA in Psychology,7131.0,CAD
University of Manitoba,Manitoba,Canada,MA in School Psychology,7131.0,CAD
Nanyang Technological University,Singapore,Singapore,MA in Psychology,15735.0,SGD
Alabama A&M University,Alabama,United States,Masters in Psychology,,USD
Memorial University of Newfoundland,Newfoundland & Labrador,Canada,MSc in Psychology,4833.0,CAD
Illinois State University,Illinois,United States,Masters in Psychology - Quantitative Psychology,14032.0,USD
Illinois State University,Illinois,United States,MS in Psychology: Cognitive and Behavioral Sciences,16682.0,USD
University of New Brunswick,New Brunswick,Canada,MA in Psychology,13302.0,CAD
Mississippi State University,Mississippi,United States,Masters in Psychology,33018.0,USD
Utah State University,Utah,United States,MED in Psychology,29856.0,USD
University of Tennessee at Knoxville,Tennessee,United States,Masters in Psychology,21568.0,USD
"Deakin University, Melbourne",Victoria,Australia,Masters in Psychology (Organisational),39200.0,AUD
"Deakin University, Melbourne",Victoria,Australia,Masters in Psychology (Clinical),39200.0,AUD
Northern Arizona University,Arizona,United States,MA in Psychological Sciences,28944.0,USD
"Southern Illinois University, Carbondale",Illinois,United States,MS in Psychology-Behavior Analysis and Therapy,28152.0,USD
The University of Sydney,New South Wales,Australia,Masters in Coaching Psychology,54000.0,AUD
RMIT University,Victoria,Australia,MSc in Psychology by Research,34560.0,AUD
Louisiana State University,Louisiana,United States,MA in Psychology,29456.0,USD
Dresden University of Technology,Sohag,Germany,Masters in Clinical Psychology and Psychotherapy,1150.0,EUR
The University of Edinburgh,Edinburgh,United Kingdom,MSc in Psychological Research,26300.0,GBP
The University of Edinburgh,Edinburgh,United Kingdom,MA in Psychology and Economics,30400.0,GBP
The University of Edinburgh,Edinburgh,United Kingdom,Masters in Social Psychology,26300.0,GBP
University of Edinburgh,Edinburgh,United Kingdom,MA in Psychology and Business,30400.0,GBP
"University of Nebraska, Lincoln",Nebraska,United States,Masters in Clinical Psychology,26855.0,USD
University of Glasgow,Glasgow City,United Kingdom,MSc in Psychological Studies (Conversion),30240.0,GBP
University College London,London,United Kingdom,MSc in Psychological Sciences,34400.0,GBP
University College London,London,United Kingdom,MSc in Brain and Mind Sciences,31200.0,GBP
University College London,London,United Kingdom,MS in Psychology and Clinical Practice,29400.0,GBP
University of Guelph,Ontario,Canada,MA in Psychology,13674.0,CAD
Friedrich-Alexander-Universität Erlangen-Nürnberg,Bavaria,Germany,Masters in Psychology,,EUR
Ohio University,Ohio,United States,MS in Psychological Science,32370.0,USD
Laval University,Quebec,Canada,MA in psychology - with dissertation,15224.0,CAD
The University of Queensland,Queensland,Australia,Masters in Business Psychology (32 Units),51200.0,AUD
"California State University, San Bernardino",California,United States,MA in Psychological Science,16236.0,USD
California Polytechnic State University,California,United States,MS in Psychology,19260.0,USD
Australian National University,Australian Capital Territory,Australia,Masters in Professional Psychology,52100.0,AUD
"California State Polytechnic University, Pomona",California,United States,MS in Psychology,29520.0,USD
University of New Mexico,New Mexico,United States,MA in Educational Psychology,18728.0,USD
Brock University,Ontario,Canada,Masters in Psychology,23502.0,CAD
"The City College of New York, CCNY",New York,United States,Masters in General Psychology,17100.0,USD
Western Illinois University,Illinois,United States,Masters in Experimental Psychology,39228.0,USD
Western Illinois University,Illinois,United States,MS in Clinical/Community Mental Health Psychology,21252.0,USD
Indiana State University,Indiana,United States,MA in Experimental Psychology,28320.0,USD
Eastern Michigan University,Michigan,United States,MS in Master's in Psychology - Clinical Behavioral,36470.0,USD
University of Memphis,Tennessee,United States,MS in General Psychology,15593.0,USD
Fairleigh Dickinson University,New Jersey,United States,MA in Forensic Psychology,15528.0,USD
Fairleigh Dickinson University,New Jersey,United States,Masters in General Theoretical Psychology,17766.0,USD
Trent University,Ontario,Canada,MSc in Psychology(Thesis),20997.0,CAD
Bowling Green State University,Ohio,United States,Masters in Psychology,13848.0,USD
The University of Adelaide,South Australia,Australia,Masters in Psychology (Health),43000.0,AUD
The University of Adelaide,South Australia,Australia,Masters in Psychology (Organisational and Human Factors),43000.0,AUD
Seattle University,Washington,United States,Masters in Psychology,27540.0,USD
State University of New York at New Paltz,New York,United States,Masters in Psychological Sciences,17860.0,USD
University of Oregon,Oregon,United States,MA in Psychology,50220.0,USD
University of Denver,Colorado,United States,MA in School Psychology,70030.0,USD
University of Denver,Colorado,United States,MA in Forensic Psychology,48594.0,USD
University of Warwick,Coventry,United Kingdom,MSc in  Psychological Research,31450.0,GBP
University of Missouri-St. Louis,Missouri,United States,M.A in Psychology Science,20504.0,USD
University of Leeds,Leeds,United Kingdom,MSc in Business Psychology,24250.0,GBP
Curtin University,Western Australia,Australia,MRes in Research (Psychology),40800.0,AUD
"Curtin University, Perth",Western Australia,Australia,Masters in Psychology (Professional),36900.0,AUD
Pittsburg State University,Kansas,United States,"MS in Psychology, Behavior Analysis",19560.0,USD
Pittsburg State University,Kansas,United States,MS in General Psychology,20022.0,USD
The University of Auckland,Auckland,New Zealand,MA in Psychology,37891.0,NZ
The University of Auckland,Auckland,New Zealand,Graduate Diploma in Applied Psychology,25579.0,NZ
The University of Auckland,Auckland,New Zealand,MS in Organisational Psychology,44526.0,NZ
University of Miami,Florida,United States,MS in Applied Behavior Analysis,46473.0,USD
Old Dominion University,Virginia,United States,MS in Psychology,23698.0,USD
"City University Of New York, Brooklyn College",New York,United States,MA in Experimental Psychology,15390.0,USD
"California State University, San Marcos",California,United States,MA in Psychological Science,22935.0,USD
Oakland University,Michigan,United States,Masters in Psychology,18486.0,USD
"Minnesota State University, Mankato",Minnesota,United States,MA in Clinical Psychology,16025.0,USD
University of Northern British Columbia,British Columbia,Canada,MSc in Psychology,7479.0,CAD
"California State University, Dominguez Hills",California,United States,MA in Psychology(Clinical Psychology),15164.0,USD
University of Akron,Ohio,United States,MA in Psychology,14585.0,USD
University of North Carolina at Greensboro,North Carolina,United States,Masters in Psychology (General Experimental Psychology),19505.0,USD
King's College London,London,United Kingdom,MSc in Organisational Psychiatry and Psychology,37368.0,GBP
King's College London,London,United Kingdom,MSc in Health Psychology,37368.0,GBP
King's College London,London,United Kingdom,MSc  in Early Intervention in Psychosis,32940.0,GBP
King's College London,London,United Kingdom,MSc in Developmental Psychology & Psychopathology,32940.0,GBP
University of Amsterdam,Amsterdam,Netherlands,Masters in Cultural Psychology,16900.0,EUR
University of Wollongong,New South Wales,Australia,Masters in Professional Psychology,34224.0,AUD
La Trobe University,Melbourne,Australia,Masters in Psychological Science (Research),39600.0,AUD
The University of Manchester,Manchester,United Kingdom,MRes  in Experimental Psychology with Data Science,25500.0,GBP
Freie University of Berlin,Berlin,Germany,Masters in Psychology,,EUR
Villanova University,Pennsylvania,United States,MS in Psychology,13350.0,USD
"University of Nebraska, Omaha",Nebraska,United States,MA in Psychology,14910.0,USD
University of Idaho,Idaho,United States,MS in Psychology,24290.0,USD
Adelphi University,New York,United States,MA in General Psychology,26820.0,USD
New Mexico State University,New Mexico,United States,MA in Experimental Psychology,19026.0,USD
Auckland University of Technology,Auckland,New Zealand,Masters in Psychotherapy,47274.0,NZ
Florida Atlantic University,Florida,United States,MA in Psychology,18468.0,USD
"University of Nevada, Reno",Nevada,United States,M.S. in Behavior Analysis,21060.0,USD
University of Twente,Overijssel,Netherlands,MSc in Psychology,11500.0,EUR
University of Bonn,North Rhine-Westphilia,Germany,Masters in Traffic Psychology,,EUR
Marshall University,West Virginia,United States,MA in Psychology,20574.0,USD
Humboldt University of Berlin,Berlin,Germany,MSc in Mind and Brain,,EUR
Humboldt University of Berlin,Berlin,Germany,Masters in Psychology,,EUR
Wilfrid Laurier University,Ontario,Canada,MSc in Psychology,21171.0,CAD
Wilfrid Laurier University,Ontario,Canada,MA in Psychology,21171.0,CAD
Otto-von-Guericke University Magdeburg,Saxony-Anhalt,Germany,Masters in Psychology,,EUR
University of Minnesota Duluth,Minnesota,United States,MA in Psychological Science,25886.0,USD
London School of Economics and Political Science,London,United Kingdom,MSc in Organisational and Social Psychology,25920.0,GBP
University of Canterbury,Canterbury,New Zealand,MSc in Psychology,40000.0,NZ
University of Canterbury,Canterbury,New Zealand,MA(Thesis) in Psychology,33000.0,NZ
University of Canterbury,Canterbury,New Zealand,MSc in Child and Family Psychology,40000.0,NZ
University of the Pacific,California,United States,MA in Behavioral Psychology,24795.0,USD
"University of the Pacific, Stockton",California,United States,Masters in Psychology,,USD
Howard University,District of Columbia,United States,MS in Psychology,28217.0,USD
The University of Western Australia,Western Australia,Australia,MS in Business Psychology,40900.0,AUD
University of Louisiana at Lafayette,Louisiana,United States,MS in Psychology,25340.0,USD
University of Central Oklahoma,Oklahoma,United States,MS in Psychology - General,13424.0,USD
University of Houston-Victoria,Texas,United States,MA in Forensic Psychology,25575.0,USD
University of South Alabama,Alabama,United States,Masters in Psychology,16848.0,USD
"California Polytechnic State University, San Luis Obispo",California,United States,MS in Psychology,20282.0,USD
University of Groningen,Groningen,Netherlands,MSc in Theory and History of Psychology,16201.0,EUR
University of Groningen,Groningen,Netherlands,MSc in Cognitive Psychology and Psychophysiology,16201.0,EUR
University of Groningen,Groningen,Netherlands,MSc in Talent Development and Creativity,16200.0,EUR
University of Groningen,Groningen,Netherlands,MSc in Psychology,14816.0,EUR
University of Birmingham,Birmingham,United Kingdom,MSc in Computational Neuroscience and Cognitive Robotics,21150.0,GBP
University of Birmingham,Birmingham,United Kingdom,MSc in Psychology,26280.0,GBP
Griffith University,Queensland,Australia,Masters in Professional Psychology,31000.0,AUD
Lancaster University,Lancashire,United Kingdom,MS in Psychology of Advertising,25700.0,GBP
Lancaster University,Lancashire,United Kingdom,MSc in Psychological Research Methods,29150.0,GBP
Texas Southern University,Texas,United States,MA in Psychology,14000.0,USD
Appalachian State University,North Carolina,United States,Masters in Industrial-Organizational Psychology and Human Resource Management (IOHRM),28101.0,USD
Appalachian State University,North Carolina,United States,MA in Psychology,19669.0,USD
California Baptist University,California,United States,MS in Industrial-Organizational Psychology,19886.0,USD
California Baptist University,California,United States,MS in Sport and Performance Psychology,22050.0,USD
Cardiff University,Cardiff,United Kingdom,MSc in Psychology,28200.0,GBP
Loughborough University,Leicestershire,United Kingdom,MSc in Work Psychology,28100.0,GBP
University of Tasmania,Tasmania,Australia,Masters in Professional Psychology,35950.0,AUD
Lund University,Sk'ne l'n,Sweden,MS in Psychology,,SEK
"City University Of New York, Queens College",New York,United States,MA in Psychology,15390.0,USD
Eberhard Karls University of Tübingen,Baden-Warttemberg,Germany,Masters in Psychology,3000.0,EUR
Ball State University,Indiana,United States,MA in Sport and Exercise Psychology,19751.0,USD
College of William & Mary,Virginia,United States,MS in Psychological Sciences,29352.0,USD
Acadia University,Nova Scotia,Canada,MSc in Psychology,13747.0,CAD
University of Liverpool,Liverpool,United Kingdom,MSc in Psychology (Conversion),26400.0,GBP
University of Liverpool,Liverpool,United Kingdom,MPhil in Psychology,12125.0,GBP
University of Liverpool,Liverpool,United Kingdom,MSc in Organisational Psychology,27500.0,GBP
University of Liverpool,Liverpool,United Kingdom,MSc in Research Methods in Psychology,24400.0,GBP
University of Liverpool,Liverpool,United Kingdom,MSc in Investigative and Forensic Psychology,23200.0,GBP
University of Liverpool,Liverpool,United Kingdom,MSc in Occupational and Organisational Psychology,24000.0,GBP
Southern New Hampshire University,New Hampshire,United States,Masters in Psychology & Law,,USD
The University of Sheffield,Sheffield,United Kingdom,MSc in Occupational Psychology,26200.0,GBP
The University of Sheffield,Sheffield,United Kingdom,MSc in Psychology and Education,21400.0,GBP
The University of Sheffield,Sheffield,United Kingdom,MSc in Psychology and Education (Conversion),20950.0,GBP
The University of Sheffield,Sheffield,United Kingdom,MSc in Work Psychology,27500.0,GBP
University of Lethbridge,Alberta,Canada,MA in Psychology,18471.0,CAD
"University of British Columbia, Okanagan",British Columbia,Canada,Masters in Psychology- psychological science,91313.0,CAD
Newcastle University,Newcastle upon Tyne,United Kingdom,MPhil in Psychology,27300.0,GBP
University of Strathclyde,Glasgow City,United Kingdom,MSc in Research Methods in Psychology,17400.0,GBP
University of Strathclyde,Glasgow City,United Kingdom,MSc in Work & Organisational Psychology,23200.0,GBP
University of Tulsa,Oklahoma,United States,MA in Clinical Psychology,31253.0,USD
Kingston University London,Kingston upon Thames,United Kingdom,MSc in Psychology,15900.0,GBP
Kingston University London,Kingston upon Thames,United Kingdom,MSc in Clinical Applications of Psychology,16200.0,GBP
Kingston University London,Kingston upon Thames,United Kingdom,MSc in Occupational and Business Psychology,17900.0,GBP
Victoria University,Victoria,Australia,Masters in Applied Psychology (Community Psychology),31000.0,AUD
Victoria University,Victoria,Australia,MS in Professional Psychology,32500.0,AUD
Western Sydney University,New South Wales,Australia,Masters in Professional Psychology,38400.0,AUD
Massey University,Manawatu-Wanganui,New Zealand,Postgraduate Diploma in Science and Technology (Psychology),37210.0,NZ
Massey University,Manawatu-Wanganui,New Zealand,MA in Psychology,32667.0,NZ
University of Tennessee at Chattanooga,Tennessee,United States,MS in Psychological Science,16056.0,USD
University of Tennessee at Chattanooga,Tennessee,United States,MS in Psychology: Research,7992.0,USD
Brandeis University,Massachusetts,United States,MA in Psychology,57860.0,USD
"James Cook University, Townsville",Queensland,Australia,Masters in Psychology (Clinical),41200.0,AUD
Central Connecticut State University,Connecticut,United States,Masters in Psychology,26072.0,USD
Arkansas Tech University,Arkansas,United States,MS in Psychology,16620.0,USD
University of Hawaii at Manoa,Hawaii,United States,MA in Psychology,21030.0,USD
"Heidelberg University, Ruperto Carola",Baden-Warttemberg,Germany,Masters in Psychology,,EUR
Golden Gate University,California,United States,MA in Master of Arts in Industrial Organisational Psychology,21255.0,USD
The University of Rhode Island,Rhode Island,United States,Masters in Psychology,,USD
University of Texas Rio Grande Valley,Texas,United States,MA in Clinical Psychology,26601.0,USD
University of Mannheim,Baden-Warttemberg,Germany,Masters in Psychology with a focus on cognitive and clinical psychology,4500.0,EUR
Flinders University,South Australia,Australia,Masters in Cognitive Psychology and Educational Practice,34000.0,AUD
Flinders University,South Australia,Australia,Masters in Psychology(Clinical),39000.0,AUD
Flinders University,South Australia,Australia,Masters in Professional Psychology,39300.0,AUD
